id,name,slug,price,description,categoryName
1,Áo thun Dinosaur 01,ao-thun-dinosaur-01,189000,Sự hiện diện của những chiếc áo thun basic cổ tròn trong tủ đồ của bạn chính là chìa khóa giúp cho bạn có thêm nhiều outfit thú vị mà lại không cần đến quá nhiều món đồ. Áo thun nữ cotton cổ tròn basic chính là vũ khí tiện dụng cho các chị em trong trang phục hàng ngày!,Áo thun
2,Áo thun Dinosaur 02,ao-thun-dinosaur-02,189000,"Thiết kế đơn giản, form dáng tiện lợi của áo thun PPN4502. Tại sao chỉ với 1 chiếc áo thun nữ basic mà bạn có thể phối với 10 bộ độ khác nhau? Câu trả lời nằm ở chính sự đơn giản của chúng",Áo thun
3,Áo somi caro 07,ao-somi-caro-07,189000,"Tay cáo, form áo cũng không hề cầu kỳ, rất dễ mặc với nhiều thân hình khác nhau. Đặc biệt hơn, màu sắc của chiếc áo phông nữ cổ tròn này cũng rất nhã nhặn, trung tính, trơn màu",Áo somi
4,Áo somi dài tay 08,ao-somi-dai-tay-08,189000,"Sự tối giản từ thiết kế, đường may đến bảng màu giúp các chị em không cần đắn đo quá nhiều khi lựa chọn. Chất liệu cotton 95% được xử lý nghiêm ngặt, quy trình và công nghệ hiện đại nên mang tới cho chiếc áo sự thoải mái, mềm mại, thoáng mát ngay khi chạm vào",Áo somi
5,Quần jean phong cách 10,quan-jean-phong-cach-10,189000,"Sự tối giản từ thiết kế, đường may đến bảng màu giúp các chị em không cần đắn đo quá nhiều khi lựa chọn. Chất liệu cotton 95% được xử lý nghiêm ngặt, quy trình và công nghệ hiện đại nên mang tới cho chiếc áo sự thoải mái, mềm mại, thoáng mát ngay khi chạm vào",Quần jean
6,Quần jean 11,quan-jean-11,189000,"Sự tối giản từ thiết kế, đường may đến bảng màu giúp các chị em không cần đắn đo quá nhiều khi lựa chọn. Chất liệu cotton 95% được xử lý nghiêm ngặt, quy trình và công nghệ hiện đại nên mang tới cho chiếc áo sự thoải mái, mềm mại, thoáng mát ngay khi chạm vào",Quần jean